### ISSUE TITLE
usocket-client-server 1-byte response.

### ISSUE THREAD

**Issue by informatimago** [informatimago/examples#1]
This is probably a usocket bug.

The client sends a 1-byte response. 
The package is correctly transmitted (at 19:10:12.818507, packet ending with 06 = ASCII ACK),
and acknowledged at the TCP layer (following packet at 19:10:12.818528) .  
But the server stays blocked in the READ-BYTE function.

(Tested with ccl).
```
[pjb@despina org.xquartz:0 client-server 89Gi]$ sudo tcpdump -n -X -vv -i lo0 port 3270
tcpdump: listening on lo0, link-type NULL (BSD loopback), capture size 262144 bytes
19:10:05.272425 IP (tos 0x0, ttl 64, id 0, offset 0, flags [DF], proto TCP (6), length 52, bad cksum 0 (->3cc2)!)
    127.0.0.1.52160 > 127.0.0.1.3270: Flags [F.], cksum 0xfe28 (incorrect -> 0x50a2), seq 2977669632, ack 3781223757, win 6379, options [nop,nop,TS val 1145869008 ecr 1145831698], length 0
	0x0000:  4500 0034 0000 4000 4006 0000 7f00 0001  E..4..@.@.......
	0x0010:  7f00 0001 cbc0 0cc6 b17b a200 e160 e54d  .........{...`.M
	0x0020:  8011 18eb fe28 0000 0101 080a 444c 92d0  .....(......DL..
	0x0030:  444c 0112                                DL..
19:10:05.272472 IP (tos 0x0, ttl 64, id 0, offset 0, flags [DF], proto TCP (6), length 52, bad cksum 0 (->3cc2)!)
    127.0.0.1.3270 > 127.0.0.1.52160: Flags [.], cksum 0xfe28 (incorrect -> 0xbee3), seq 1, ack 1, win 6379, options [nop,nop,TS val 1145869008 ecr 1145869008], length 0
	0x0000:  4500 0034 0000 4000 4006 0000 7f00 0001  E..4..@.@.......
	0x0010:  7f00 0001 0cc6 cbc0 e160 e54d b17b a201  .........`.M.{..
	0x0020:  8010 18eb fe28 0000 0101 080a 444c 92d0  .....(......DL..
	0x0030:  444c 92d0                                DL..
19:10:05.272696 IP (tos 0x0, ttl 64, id 0, offset 0, flags [DF], proto TCP (6), length 52, bad cksum 0 (->3cc2)!)
    127.0.0.1.3270 > 127.0.0.1.52160: Flags [F.], cksum 0xfe28 (incorrect -> 0xbee2), seq 1, ack 1, win 6379, options [nop,nop,TS val 1145869008 ecr 1145869008], length 0
	0x0000:  4500 0034 0000 4000 4006 0000 7f00 0001  E..4..@.@.......
	0x0010:  7f00 0001 0cc6 cbc0 e160 e54d b17b a201  .........`.M.{..
	0x0020:  8011 18eb fe28 0000 0101 080a 444c 92d0  .....(......DL..
	0x0030:  444c 92d0                                DL..
19:10:05.272716 IP (tos 0x0, ttl 64, id 0, offset 0, flags [DF], proto TCP (6), length 52, bad cksum 0 (->3cc2)!)
    127.0.0.1.52160 > 127.0.0.1.3270: Flags [.], cksum 0xfe28 (incorrect -> 0xbee2), seq 1, ack 2, win 6379, options [nop,nop,TS val 1145869008 ecr 1145869008], length 0
	0x0000:  4500 0034 0000 4000 4006 0000 7f00 0001  E..4..@.@.......
	0x0010:  7f00 0001 cbc0 0cc6 b17b a201 e160 e54e  .........{...`.N
	0x0020:  8010 18eb fe28 0000 0101 080a 444c 92d0  .....(......DL..
	0x0030:  444c 92d0                                DL..
19:10:12.817592 IP (tos 0x0, ttl 64, id 0, offset 0, flags [DF], proto TCP (6), length 64, bad cksum 0 (->3cb6)!)
    127.0.0.1.52165 > 127.0.0.1.3270: Flags [S], cksum 0xfe34 (incorrect -> 0x2ad6), seq 1280621215, win 65535, options [mss 16344,nop,wscale 6,nop,nop,TS val 1145876531 ecr 0,sackOK,eol], length 0
	0x0000:  4500 0040 0000 4000 4006 0000 7f00 0001  E..@..@.@.......
	0x0010:  7f00 0001 cbc5 0cc6 4c54 ba9f 0000 0000  ........LT......
	0x0020:  b002 ffff fe34 0000 0204 3fd8 0103 0306  .....4....?.....
	0x0030:  0101 080a 444c b033 0000 0000 0402 0000  ....DL.3........
19:10:12.817721 IP (tos 0x0, ttl 64, id 0, offset 0, flags [DF], proto TCP (6), length 64, bad cksum 0 (->3cb6)!)
    127.0.0.1.3270 > 127.0.0.1.52165: Flags [S.], cksum 0xfe34 (incorrect -> 0x353d), seq 60030324, ack 1280621216, win 65535, options [mss 16344,nop,wscale 6,nop,nop,TS val 1145876531 ecr 1145876531,sackOK,eol], length 0
	0x0000:  4500 0040 0000 4000 4006 0000 7f00 0001  E..@..@.@.......
	0x0010:  7f00 0001 0cc6 cbc5 0393 fd74 4c54 baa0  ...........tLT..
	0x0020:  b012 ffff fe34 0000 0204 3fd8 0103 0306  .....4....?.....
	0x0030:  0101 080a 444c b033 444c b033 0402 0000  ....DL.3DL.3....
19:10:12.817731 IP (tos 0x0, ttl 64, id 0, offset 0, flags [DF], proto TCP (6), length 52, bad cksum 0 (->3cc2)!)
    127.0.0.1.52165 > 127.0.0.1.3270: Flags [.], cksum 0xfe28 (incorrect -> 0x9646), seq 1, ack 1, win 6379, options [nop,nop,TS val 1145876531 ecr 1145876531], length 0
	0x0000:  4500 0034 0000 4000 4006 0000 7f00 0001  E..4..@.@.......
	0x0010:  7f00 0001 cbc5 0cc6 4c54 baa0 0393 fd75  ........LT.....u
	0x0020:  8010 18eb fe28 0000 0101 080a 444c b033  .....(......DL.3
	0x0030:  444c b033                                DL.3
19:10:12.817738 IP (tos 0x0, ttl 64, id 0, offset 0, flags [DF], proto TCP (6), length 52, bad cksum 0 (->3cc2)!)
    127.0.0.1.3270 > 127.0.0.1.52165: Flags [.], cksum 0xfe28 (incorrect -> 0x9646), seq 1, ack 1, win 6379, options [nop,nop,TS val 1145876531 ecr 1145876531], length 0
	0x0000:  4500 0034 0000 4000 4006 0000 7f00 0001  E..4..@.@.......
	0x0010:  7f00 0001 0cc6 cbc5 0393 fd75 4c54 baa0  ...........uLT..
	0x0020:  8010 18eb fe28 0000 0101 080a 444c b033  .....(......DL.3
	0x0030:  444c b033                                DL.3
19:10:12.818224 IP (tos 0x0, ttl 64, id 0, offset 0, flags [DF], proto TCP (6), length 59, bad cksum 0 (->3cbb)!)
    127.0.0.1.3270 > 127.0.0.1.52165: Flags [P.], cksum 0xfe2f (incorrect -> 0xa898), seq 1:8, ack 1, win 6379, options [nop,nop,TS val 1145876531 ecr 1145876531], length 7
	0x0000:  4500 003b 0000 4000 4006 0000 7f00 0001  E..;..@.@.......
	0x0010:  7f00 0001 0cc6 cbc5 0393 fd75 4c54 baa0  ...........uLT..
	0x0020:  8018 18eb fe2f 0000 0101 080a 444c b033  ...../......DL.3
	0x0030:  444c b033 4845 4c4c 4f0d 0a              DL.3HELLO..
19:10:12.818258 IP (tos 0x0, ttl 64, id 0, offset 0, flags [DF], proto TCP (6), length 52, bad cksum 0 (->3cc2)!)
    127.0.0.1.52165 > 127.0.0.1.3270: Flags [.], cksum 0xfe28 (incorrect -> 0x963f), seq 1, ack 8, win 6379, options [nop,nop,TS val 1145876531 ecr 1145876531], length 0
	0x0000:  4500 0034 0000 4000 4006 0000 7f00 0001  E..4..@.@.......
	0x0010:  7f00 0001 cbc5 0cc6 4c54 baa0 0393 fd7c  ........LT.....|
	0x0020:  8010 18eb fe28 0000 0101 080a 444c b033  .....(......DL.3
	0x0030:  444c b033                                DL.3
19:10:12.818507 IP (tos 0x0, ttl 64, id 0, offset 0, flags [DF], proto TCP (6), length 53, bad cksum 0 (->3cc1)!)
    127.0.0.1.52165 > 127.0.0.1.3270: Flags [P.], cksum 0xfe29 (incorrect -> 0x9035), seq 1:2, ack 8, win 6379, options [nop,nop,TS val 1145876532 ecr 1145876531], length 1
	0x0000:  4500 0035 0000 4000 4006 0000 7f00 0001  E..5..@.@.......
	0x0010:  7f00 0001 cbc5 0cc6 4c54 baa0 0393 fd7c  ........LT.....|
	0x0020:  8018 18eb fe29 0000 0101 080a 444c b034  .....)......DL.4
	0x0030:  444c b033 06                             DL.3.
19:10:12.818528 IP (tos 0x0, ttl 64, id 0, offset 0, flags [DF], proto TCP (6), length 52, bad cksum 0 (->3cc2)!)
    127.0.0.1.3270 > 127.0.0.1.52165: Flags [.], cksum 0xfe28 (incorrect -> 0x963c), seq 8, ack 2, win 6379, options [nop,nop,TS val 1145876532 ecr 1145876532], length 0
	0x0000:  4500 0034 0000 4000 4006 0000 7f00 0001  E..4..@.@.......
	0x0010:  7f00 0001 0cc6 cbc5 0393 fd7c 4c54 baa1  ...........|LT..
	0x0020:  8010 18eb fe28 0000 0101 080a 444c b034  .....(......DL.4
	0x0030:  444c b034                                DL.4
19:11:14.002597 IP (tos 0x0, ttl 64, id 0, offset 0, flags [DF], proto TCP (6), length 52, bad cksum 0 (->3cc2)!)
    127.0.0.1.52165 > 127.0.0.1.3270: Flags [F.], cksum 0xfe28 (incorrect -> 0xa7f4), seq 2, ack 8, win 6379, options [nop,nop,TS val 1145937530 ecr 1145876532], length 0
	0x0000:  4500 0034 0000 4000 4006 0000 7f00 0001  E..4..@.@.......
	0x0010:  7f00 0001 cbc5 0cc6 4c54 baa1 0393 fd7c  ........LT.....|
	0x0020:  8011 18eb fe28 0000 0101 080a 444d 9e7a  .....(......DM.z
	0x0030:  444c b034                                DL.4
19:11:14.002639 IP (tos 0x0, ttl 64, id 0, offset 0, flags [DF], proto TCP (6), length 52, bad cksum 0 (->3cc2)!)
    127.0.0.1.3270 > 127.0.0.1.52165: Flags [.], cksum 0xfe28 (incorrect -> 0xb9ad), seq 8, ack 3, win 6379, options [nop,nop,TS val 1145937530 ecr 1145937530], length 0
	0x0000:  4500 0034 0000 4000 4006 0000 7f00 0001  E..4..@.@.......
	0x0010:  7f00 0001 0cc6 cbc5 0393 fd7c 4c54 baa2  ...........|LT..
	0x0020:  8010 18eb fe28 0000 0101 080a 444d 9e7a  .....(......DM.z
	0x0030:  444d 9e7a                                DM.z
19:11:14.002858 IP (tos 0x0, ttl 64, id 0, offset 0, flags [DF], proto TCP (6), length 52, bad cksum 0 (->3cc2)!)
    127.0.0.1.3270 > 127.0.0.1.52165: Flags [F.], cksum 0xfe28 (incorrect -> 0xb9ac), seq 8, ack 3, win 6379, options [nop,nop,TS val 1145937530 ecr 1145937530], length 0
	0x0000:  4500 0034 0000 4000 4006 0000 7f00 0001  E..4..@.@.......
	0x0010:  7f00 0001 0cc6 cbc5 0393 fd7c 4c54 baa2  ...........|LT..
	0x0020:  8011 18eb fe28 0000 0101 080a 444d 9e7a  .....(......DM.z
	0x0030:  444d 9e7a                                DM.z
19:11:14.002906 IP (tos 0x0, ttl 64, id 0, offset 0, flags [DF], proto TCP (6), length 52, bad cksum 0 (->3cc2)!)
    127.0.0.1.52165 > 127.0.0.1.3270: Flags [.], cksum 0xfe28 (incorrect -> 0xb9ac), seq 3, ack 9, win 6379, options [nop,nop,TS val 1145937530 ecr 1145937530], length 0
	0x0000:  4500 0034 0000 4000 4006 0000 7f00 0001  E..4..@.@.......
	0x0010:  7f00 0001 cbc5 0cc6 4c54 baa2 0393 fd7d  ........LT.....}
	0x0020:  8010 18eb fe28 0000 0101 080a 444d 9e7a  .....(......DM.z
	0x0030:  444d 9e7a                                DM.z
```
